{
  "name": "Easter Sunday",
  "name_local": "Paques",
  "language": "FR",
  "description": "Easter Sunday marks the resurrection of Jesus Christ",
  "country": "US",
  "location": "",
  "type": "National",
  "date": "04/20/2025",
  "date_year": "2025",
  "date_month": "04",
  "date_day": "20",
  "week_day": "Sunday"
}